{
  "profile_id": "CFP-0004",
  "channel_ref": "https://www.youtube.com/@portal",
  "channel_name": "Portal",
  "sample_size": 1,
  "hook_pattern": {
    "duration_s": 20,
    "type": "in_media_res",
    "description": "Cold open directly inside a mainstream pop-culture scene/character crisis (named examples: Fight Club, Matrix, Joker, Evangelion, Berserk) - no channel branding, no summary, immediately paired with a heavy philosopher quote and a bridge to the viewer's own daily life (commute, office, bills). Source calls this a 'Truva Atı Stratejisi' (Trojan Horse strategy): the audience searches for a film analysis and receives a philosophy lecture. Functions rhetorically like a question hook but isn't literally phrased as one, hence 'in_media_res' rather than 'question'. Duration is a rough estimate (~20s), not frame-counted - schema max is 30s and the source gives no precise number."
  },
  "narration_pace_wpm": 120,
  "music_density": "continuous",
  "narrative_structure": "other",
  "confidence": 0.55,
  "generated_at": "2026-08-08T00:00:00+00:00",
  "sha256": "4d928877c7c7405d79d6506c3f03e94def89801ec522370c19f69ae7738d57a8",
  "disclaimer": "Structural/format analysis only. No content reproduction.",
  "notes": "Not run through Module 21's own Gemini pipeline (disabled this session, see CFP-0001) - formalizes the user's own structural analysis of a THIRD channel, 'Portal', supplied as an 11-file, 50-madde (10-bölüm) structural deep-dive (archived at reports/source_docs/portal_50madde/), the same depth/format as the newly-supplied Gerçeği Bul and Nida Yıldırım updates (see CFP-0002/CFP-0003 notes). No prior CFP report or template existed for this channel before 2026-08-08. Channel's own self-given labels (verbatim): 'Format B: Derinleşme (Refinement)', 'Video Essay (Sinematik Deneme)', 'Kamerasız (Faceless) Sessiz Rehber'. narrative_structure is 'other' rather than any listed enum value because the source names the real structure as a tez-antitez-sentez (thesis-antithesis-synthesis) dialectic wrapped in a döngüsel kurgu (narrative loop) with invisible chaptering and metaphor callback - a video-essay/dialectical-argument architecture that doesn't map cleanly onto hero_journey/problem_solution/storytelling/educational. narration_pace_wpm (~115-125, recorded as 120) and cut_frequency_per_min/avg_scene_length_s (left unset) are qualitative estimates only, inferred from descriptors like 'ağır ritim', 'Slow Content', '3-4 saniyelik sessizlik' pauses, 'sinema salonunda film izler gibi' - not frame-counted, lower confidence than the frame-adjacent claims. music_density is continuous per the source's own 'İşitsel İzolasyon (Tunneling)' concept - an always-on ambient/lofi bed the format explicitly relies on never dropping out. confidence (0.55) is lower than CFP-0002/0003 because this is a single-source, first-pass profile for a channel not previously analyzed at all in this repo (no prior WebSearch cross-check performed this session either).\n\nEDITORIAL FLAG (required by CLAUDE.md law #4 - documented here, not smoothed over): this source material, more than the other two, explicitly frames the viewer's depression/meaninglessness NOT as a condition but as (source's own words) 'akıllı bir insanın bu dünyaya vereceği en doğal tepki... en rasyonel reaksiyon (meşru acı)' - i.e. treats nihilistic/depressive ideation as evidence of the viewer's superior awareness, and positions the channel itself as a 'dijital terapi odası' (digital therapy room) / 'yargısız Safe Space'. It also names building a 'kült' around an anonymous, deliberately-unaccountable 'mitolojik, bilge gölge mentor' narrator as a scored SUCCESS metric (source's own word choice, unhedged), with real thinkers' documented suicides/institutionalization used as a 'yenilgi paydası' (shared-defeat bonding device). This is a different and more serious category of concern than CFP-0002's doubt-manufacturing (a peripheral rule that can be cleanly excluded from a hybrid template) - here the nihilism-as-therapy framing and cult-building language are woven through the format's persona/pacing/community design as its central thesis, not an excisable side-rule. Per Module 21's own scope boundary ('structural/format analysis only, no content reproduction'), documenting that the channel's OWN rhetoric does this is within bounds - producing new content that itself performs the technique is not, and no such content has been produced. See templates/TPL-portal-video-essay.json's content_rules.rules_explicitly_not_adopted for how this was handled when building a production template from this profile."
}
