{
  "profile_id": "CFP-0003",
  "channel_ref": "https://www.youtube.com/@nida.yldrim",
  "channel_name": "Nida Yıldırım",
  "sample_size": 1,
  "hook_pattern": {
    "type": "other",
    "description": "Opens on the viewer's personal problem (exhaustion, meaninglessness, searching) with an imperative call to action rather than a mystery question - e.g. titles phrased as instructions ('Çabalama Artık!') rather than questions. Duration not stated in the user's source material, left unset rather than assumed equal to the other format. Confirmed 2026-08-08 by an independent 50-madde deep-dive source under the label 'Kişisel Dönüşüm Kancası' (Personal Transformation Hook) + 'Emir Kipi ve Talimat' (imperative titles like 'Hakkın Yok') - matches this description closely; still no frame-counted duration given."
  },
  "narration_pace_wpm": 130,
  "music_density": "sparse",
  "narrative_structure": "educational",
  "confidence": 0.75,
  "generated_at": "2026-08-06T14:00:00+00:00",
  "sha256": "1d9ee276d93b1cb2b4ee24d4b71b107720f1cbb14e87dadf6a9f7a57abc9d210",
  "disclaimer": "Structural/format analysis only. No content reproduction.",
  "notes": "Not run through Module 21's own Gemini pipeline (disabled this session, see CFP-0001) - formalizes the user's own structural analysis of the channel (1 Word document, 5 'Boutique Intellectual' rules), cross-checked against a WebSearch confirming the channel is real and topically matches (philosophy/art/history, calm deep-reading format, motto 'Görmek konuşmaktan önce gelir'). narration_pace_wpm and music_density are estimates from qualitative descriptors ('yavaş, düşündürücü, sakin' pacing; minimalist non-vocal music implied by the shared narrator-persona doc that applies to both of the user's channel formats) - not frame-counted, treated as approximate; cut_frequency_per_min and hook duration are left unset since the source material gives no cadence numbers for this format (only for the other one). Key rules NOT captured by this schema's structural fields (recorded in templates/TPL-boutique-intellectual.json instead, per Module 21's own structural-only boundary, §2): curation-over-chronology (ideas/thinkers, not events), 'authority aesthetic' - clean, bright, library/study production values (opposite of the other channel's dark mystery aesthetic), personal-brand-forward delivery (the presenter's perspective is the product, not just the information), deliberate slow-content pacing that trades fast growth for audience loyalty. Format role in the user's hybrid model: 'Derinleşme' (Refinement) - slow-cadence, trust/loyalty-driven, not algorithm-facing; publishes ~1x/month; converts the other format's (CFP-0002) discovery traffic into subscribers via a shared narrator voice and an explicit bridge line at the end of Format A videos. UPDATE 2026-08-08: a new, independently-produced 50-madde (10-bölüm) structural deep-dive was supplied (archived at reports/source_docs/nida_yildirim_50madde/) that corroborates the above characterization and raises confidence from 0.6 to 0.75. Unlike the Gerçeği Bul update, this new source did NOT sharpen toward anything ethically concerning - the channel's own 'safe exit'/closing rules here are notably measured: 'otoriteyi insanileştirme' (humanizing cited thinkers via their real flaws/struggles) and 'tatminsizliğin meşrulaştırılması' as a normal, structural part of being human (not a pathology) - a meaningfully gentler framing than a separate new channel profile (CFP-0004, 'Portal') which frames nihilism/depression as a superior-rational-response and builds explicit 'cult' language around its anonymous narrator; the two should not be conflated despite superficially similar 'safe exit' vocabulary. New concrete detail: closing CTA style ('Boutique Topluluk Eylemi') is modest - invites a 'kabilenin nitelikli fikir fırtınası' (a qualified brainstorm among the tribe), not an intense parasocial pitch. templates/TPL-boutique-intellectual.json's content_rules lightly enriched with the new curation-language details (Bölüm 3-4: framing information as a portable 'zihinsel araç', explicit rejection of jump-cut/dopamine-chasing editing) without changing the template's existing structure or tone."
}
